{
  "schema_version": "confenge.staffed_capacity_snapshot.v1",
  "capacity_snapshot_id": "cap_synthetic_diag_one_20260825",
  "version": 1,
  "synthetic": true,
  "as_of": "2026-08-25T12:00:00Z",
  "expires_at": "2026-09-30T23:59:59Z",
  "staffed_capacity_units": 1,
  "unit": "delivery_slot",
  "evidence_refs": ["fixture://Governance/delivery/fixtures/capacity-synthetic-one.v1.json"],
  "working_calendar": {
    "version": "CFG-CALENDAR-SYNTHETIC-BR-2026-v1",
    "timezone": "America/Sao_Paulo",
    "valid_from": "2026-08-01",
    "valid_until": "2026-12-31",
    "working_weekdays": [0, 1, 2, 3, 4],
    "holidays": ["2026-09-07", "2026-10-12", "2026-11-02", "2026-11-20", "2026-12-25"]
  },
  "policy_ceiling_used_as_staffed_capacity": false,
  "real_checkout_enabled": false
}
